{
  "lip": 1,
  "store": "lets-store",
  "description": "Community lets store: static uniques you can open in a browser pane and talk through with Claude.",
  "updated": "2026-10-13",
  "uniques": [
    {
      "name": "cocode",
      "title": "Cocode — talk in code",
      "description": "Type in any language, even one that doesn't exist: Claude predicts your next lines as a ghost, builds the real program ahead so Run is instant, and reads what you send as a question or a task. Installed from the store; not a default.",
      "repo": "https://github.com/TikoTikTok/lets-unique-cocode.git",
      "path": "",
      "ref": "main",
      "verified": true,
      "tags": ["code", "editor", "predict", "run", "pseudo-code"],
      "author": "TikoTikTok"
    },
    {
      "name": "den",
      "title": "Den — Doto's home",
      "description": "See what the companion learned about you and edit or forget any of it by pointing: persona, traits, likes, nicknames, memory, skills, secrets found. Installed by default with lets 0.6.0.",
      "repo": "https://github.com/TikoTikTok/lets-unique-den.git",
      "path": "",
      "ref": "main",
      "verified": true,
      "tags": ["companion", "memory", "persona", "skills", "default"],
      "author": "TikoTikTok"
    },
    {
      "name": "graph",
      "title": "Graph — talk in diagrams",
      "description": "Draw flows and ideas; the companion and Claude read and edit the same board. Installed by default with lets.",
      "repo": "https://github.com/TikoTikTok/lets-unique-graph.git",
      "path": "",
      "ref": "main",
      "verified": true,
      "tags": ["graph", "diagram", "flow", "default"],
      "author": "TikoTikTok"
    },
    {
      "name": "mors",
      "title": "Mors — talk in Morse",
      "description": "One key, one tape: key your message in dots and dashes and send it to Claude, who reads it as a prompt. Only Doto helps you craft it (read-back, spell as a ghost, chart, full controller), and Claude can answer in Morse on the tape. Installed from the store; not a default.",
      "repo": "https://github.com/TikoTikTok/lets-unique-mors.git",
      "path": "",
      "ref": "main",
      "verified": true,
      "tags": ["morse", "key", "tape", "signal", "prompt"],
      "author": "TikoTikTok"
    },
    {
      "name": "pulse",
      "title": "Pulse — a dial you talk through",
      "description": "The template unique: a mood dial with three modes; the companion reacts. Start here to build your own.",
      "repo": "https://github.com/TikoTikTok/lets-unique-template.git",
      "path": "",
      "ref": "main",
      "verified": true,
      "tags": ["template", "example", "dial"],
      "author": "TikoTikTok"
    }
  ]
}
